# Tests for updating rows from a table

statement ok
create table t1 as select * from generate_series(1, 7, 2);

statement ok
update t1 set generate_series = 3 where generate_series > 6;

query I
select * from t1;
----
1
3
5
3

statement ok
update t1 set generate_series = 3;

query I
select * from t1;
----
3
3
3
3

statement error Update statement with table reference in column name
update t1 set t1.generate_series = 1;

statement ok
create external table t3 from debug options (table_type = 'never_ending');

statement error UPDATE with external tables
update t3 set a = 10;

statement ok
create table t2(a bigint, b bigint);

statement ok
insert into t2 values (1, 3), (4, 4), (2, 6), (3,8);

statement ok
update t2 set a = 2, b = 4 where b = 3;

query II
select * from t2 where b = 4;
----
2 4
4 4
